file_id,contents,user_id,subforum_id,num_contexts,label
33222250_1,I would not be surprised if this woman was specifically targeted by local Jews from her town for this abominable treatment .,572710,1346,2,1
13481672_2,If they were jew pieces of garbage who the hell cares what happened to them .,584956,1345,0,1
13456820_1,Put that fat Black idiot to work and she would n't be smirking at Whitey and playing stupid for the camera at her welfare review hearing !,572059,1347,0,1
13456898_1,"I know exactly what you 're saying , I just hate to see those worthless apes benefit from the great things that whites do .",572496,1396,0,1
14678603_1,I am White and I believe all White people know the difference between right and wrong no matter what they say about their political positions.We are facing genocide as a people and the infighting is just loved by non Whites .,572073,1371,0,1
30582420_2,Also notice that the Nig giving the running commentary said nothing about the ' White boy ' a term the Yard Ape will never fail to use when given the chance !,573419,1359,0,1
12849464_4,And the sad thing is the white students at those schools will act like that too .,575975,1346,1,1
30954922_2,"JAPs are a total hoot , each the center of the universe , loud , brash , vain , arrogant . . .",572228,1346,0,1
30451625_3,I went back a cpl years ago and the black vermin were everywhere .,577167,1388,0,1
13379594_2,Sub 70 I.Q. I would say for sure .,574041,1345,1,1
14670410_2,The only thing Negroes have is wishful want .,576425,1371,1,1
13854327_1,You cant expect those poor underprivilidged blacks to have to put up with this cold weather .,587508,1391,0,1
14023149_1,Yeah they are buying a lot of houses around my area to probz so they can house there massive inbred family when they come over to the UK .,574612,1387,0,1
14302798_1,Call the jackass and tell him about hundreds of thousands of foreign nationals who have invaded our country and laid seige to our cities on May 1 .,573309,1380,1,1
14671829_8,Tell them we 'll legalize drugs and pedophilia .,573247,1371,5,1
30451811_1,It is a total disgrace when tax-payer dollars can go to promoting such degenerate filth .,735451,1388,0,1
13461331_2,"I 'm moving to a bigger house pretty soon , and that map is perfect for doing a groidal analysis .",575828,1346,0,1
13475861_1,i love it when jews get a taste of thier own vile medicene I hope each and every one of them young to old starve in the cold,574312,1345,0,1
14417385_2,Regurgitation of good info is better than ingestion of jewish-disinformation .,573810,1375,1,1
30534328_2,Lying Marxists !,576359,1354,0,1
14667042_2,"In fact , if you buy California fruit , you have tasted illegal alien DNA .",572043,1371,0,1
14038785_1,England has been Jew infested for centuries and the BBC is the centre of the Marxist propaganda mill .,572367,1387,0,1
13449604_1,because they deserve at least a taste of it for helping the white liberals and Jews push it on us I do n't think we should allow it to destroy them though .,572896,1347,0,1
30453770_1,You find they are worse since they will able to blend more and fool people into thinking they 're genuine .,572990,1354,1,1
30618051_1,"If you want to see what having a black , kenyan White-hating muslime in the Whitehouse has created , go look at Tarantino 's latest flick Django Unchained .",739787,1359,0,1
13501185_1,"they played this on fox news today.said she went ape schmidt , no pun intended , because they had no baffrooms.fox news sucks but at least people get a couple seconds of real news ......... secondly , ive never heard of a sheboon before.a new specie , from the chimpout family ?",575682,1345,1,1
30754357_1,"`Interesting' to see someone of the same radio outfit to praise this figure , while there was an amazing show dedicated to uncovering the facts regarding this anti-German filth .",576340,1354,1,1
30500254_14,"It 's annoying to live in a time where a subhuman monkey coon thinks it 's okay to hit an Aryan white blond , blue-eyed child .",575946,1362,0,1
13496220_2,The only way to deal with these animals is to give them a one way ticket to their filthy pig god .,575090,1395,4,1
30466436_1,"I know I keep hoping I wake up one day and this multiracial hell Canada was all just a terrible nightmare , but it never happens .",735180,1388,0,1
14297733_2,Black and Asian immigrants who are coming in and those who were borne here and their breading patterns are the threat to our gene pool and not other white Europeans such as polish people .,605744,1380,0,1
30486700_1,There is no good in reasoning a bitch that is hungry for a dick.Forget her and let her perish in shame after negroid kicks her after a few tries .,734778,1388,0,1
30392180_6,The big black females pushed their way into the Houston city counsel meeting and said all of the white teachers they used to have all quit ( do you wonder why ? ) and all you sent us to replace all them teachers was a bunch of dumb blacks .,573148,1362,0,1
30457462_1,If I could create a disease that wipes out all Black 's I would .,575397,1388,0,1
30546860_3,The thought of Africans in space is laughable .,734911,1348,0,1
13470519_1,"We spent too much time and effort worrying about Blacks while the Asians and Hispanics , were the ones carrying the ball .",583261,1346,8,1
12848217_3,"I was basically a babysitter , and the apes went nuts , and frankly , I could not control them and had to press the panic button twice to get someone to help me .",575810,1346,0,1
30496402_1,"I honestly hate Indians , Muslims , really anything with brown , black or yellow coloured skin I hate .",575397,1388,0,1
14677826_3,We can all put down our torches go home and suck some Jew d@cK JUST LIKE YOU !,572816,1371,0,1
30500254_15,Yet my daughter still wants to go outside and play with that thing .,575946,1362,0,1
30625900_1,I wonder why the Jewish Media always pretends that all the blood thirsty third world savages are victims and it is all Whitey 's fault ?,573148,1346,0,1
13391410_1,they act as if negros with aids should have the right to reproduce when they will die off and have no way to take care of the kid I cant believe that they are doing this by the millions its crazy,579214,1345,1,1
14035723_1,Depending on which part of Scotland you 're going to I might have some bad news for you about the Kaffirs .,572058,1387,0,1
13563834_2,"The natural royality of the planet was not the posing apes , but the Overman .",580949,1347,1,1
13858341_1,"I disagree you can never justify race mixing Some of them girls may have been brainwashed by media , also you are condemning their kids and furture generations of kids to a non white future .",592767,1391,0,1
30461147_1,"When the entire non-White world is breathing down your neck waiting for an opportunity to kill you , anything you do to protect yourself is self-defense .",572058,1359,0,1
14034808_1,"Yes, more homosexual degeneracy foisted upon the silent majority .",572357,1387,0,1
12860462_4,They all deserve an ass kicking .,572067,1346,0,1
13852694_3,Cowardly scum from the Irish countryside bigging up in army jackets .,573444,1391,0,1
13332658_1,Let mother nature evolve these people naturally because no amount of money or aid is going to drag these ' things ' into the civilized world where they serve absolutely no purpose .,579513,1345,2,1
30560311_2,I 'm surprised they 're not holding the gun back to front .,578431,1359,0,1
13455369_4,"WE GOT MONEY AROUND HERE TOO Compton Crips Pt.1 - YouTube These negroes are in the middle of the street , seems like something of a zoo , playing with their cheap lowriders .",582378,1347,6,1
13862051_2,"They sound so naive , when will they learn that these people do not want to intergrate just accumulate .",592775,1391,0,1
14073043_1,This gay kill a young bulgarian man to protect some criminal brown gypsy from beating This is the true face of so-called `` anti-racist '' !,575124,1383,0,1
13285245_1,"May they just need to turn these savages loose , justice will take care of itself .",573347,1345,15,1
13059807_3,Are there any whites left in that craphole or have they all been killed ?,574041,1345,1,1
14670222_1,"Gay marriage has no place in any society , regardless of your race and culture.It destroys , morals , values , and the future of your offspring that will keep your race and culture alive.Regardless of your race and culture , homosexuality and gay marriage is the genocide of mankind .",614078,1371,0,1
13846782_1,it is down to the EU.we have no say anymore on any piece of scum coming into the country as long as they have an EU passport,591076,1391,0,1
14664558_2,If it continues England will become a cesspool of sh * * pardon my English,574356,1371,0,1
30679934_1,"the kind of perversion that leads to homosexuality also leads to pedophilia. why take the risk , and even if the homosexuals turned out not to be pedophiles why would anyone want a child to live with two perverts .",606437,1362,0,1
31765374_1,i live up the block from a muslim mask. every friday they rule the streets. they think that they can walk anywhere they want and if your are white they give you a look just klike when you pass through a black neighborhood. they are the same as them nigs,750200,1363,0,1
12868841_1,"I do n't watch any movie that is made for blacks or has a black in the lead roll and I ca n't find humor in the black race with all of the crime they comit against the white man , to hell with them .",572496,1346,0,1
14037300_1,Hiya i 'm new here and sick of watching my country become infected with the disease of multiculturalism .,596600,1387,0,1
13473247_5,Soon in their minds it is ok to date them and have children with them thus polluting our great race and pushing us further toward extinction .,583605,1346,0,1
13299159_1,"Perhaps I should walk back into my H.S. when it starts Monday and get on the P.A. system and say I want to tie all * * * * * * s to the back of my car and drag them across the ground till they die , and then say I 'm joking .",579220,1345,2,1
13379594_3,Why should we try to civilize that which cannot be domesticated or civil ?,574041,1345,1,1
30837533_1,"A Kosher slaughter , blessed by every Rabbi under the sun .",572087,1346,0,1
30777933_2,Only they do and all their brainwash followers .,573685,1363,0,1
13855496_1,Watching those videos makes me feel like im going to explode with hatred for those creatures .,587508,1391,7,1
13843729_1,What a load of crap.Water are ye people for real Ireland is been taken over by non Irish and this rubbish .,579630,1391,0,1
13492599_1,Well they have got to be more aware then the idiots we have over here absorbing all the bs with there little sponge brains .,577335,1395,1,1
30424025_1,Their aggressiveness is a massive reason for their ' success ' .,579858,1362,11,1
14031187_3,There are London areas that could be described as nothing less than little islamic republics .,572512,1387,0,1
13401479_1,Just shows how thick they actually are one farmer-one bullet they will just end up starving and asking WHITES to feed them,581238,1345,3,1
14651426_3,The blood of hundreds of white women is on the hands of white liberals .,574041,1371,0,1
13862647_1,"Most of them dont even work , but I have no doubt that some of them will be pushed into high positions in society .",591103,1391,1,1
33222250_2,"They must have trapped her somehow , and sent her thru the network to Israel .",572710,1346,2,1
13458115_1,I looked at the discussion and it is obvious that we are outnumbered by non-whites and race traitors and follow the other followers types .,572266,1347,0,1
13456820_2,"Better yet , make her the poster child for Black Resettlement ! Spending her days digging for grub worm dinners would actually be good for her .",572059,1347,0,1
13477832_3,When ever I see these white children murdered by these sub humans it makes me so angry I could cry .,573347,1345,0,1
31402537_4,I would n't marry a asian even after cirurgy .,572176,1346,0,1
14034375_1,the black security guards are racist and look evil and are always giving dirty looks to white customers especially polish customers !,595808,1387,0,1
14414465_3,http://www.abc25.com/Global/story.asp ? S = 5352185 Non whites commit far more crimes against whites each year but its never considered a hate crime and alot of them never spend any time in jail !,573600,1375,0,1
13379594_1,Powerful video that shows how primitive these beasts are .,574041,1345,1,1
14300900_3,"When the non-whites come we should stand together and send em packing , like they do to us .",579227,1380,0,1
30954922_1,"I wish you luck , is it any wonder Jew males lust for our White women ?",572228,1346,0,1
31769461_1,"Fags are a big problem , they are recruiting our kids , in the schools that we pay for .",589998,1363,0,1
13944391_2,Most if not all of the whites at my school are complete race traitors,581731,1388,0,1
14669208_2,The next generation of humanity should thank you for not having been infected with your flawed genetic structure .,572648,1371,1,1
30420875_3,It really pisses of the liberal leftist,572790,1388,0,1
31732793_2,When I see this stuff nowadays it makes me wa n't to punch the white people who fall for it .,577415,1363,0,1
13621261_6,"The Chechen beast was one of those who committed killing in the name of Allah against our Russian brothers , like the theater in Moskva .",579371,1393,0,1
30507680_3,"All we have is blacks and a few mestizos and all are pretty well behaved , we keep them that way around here",603922,1362,0,1
30451811_2,But what do you expect with a homosexual Muslim as the mayor ?,735451,1388,0,1
30654383_2,Egyptian TV Host : The Jews Are Using the Holocaust to Suck the Blood of the Germans - YouTube,572231,1354,0,1
13486963_2,"But you must know that caucasians is not like blacks , they just animals and subhumans .",572316,1395,0,1
13552491_3,"Blacks and mexicans were represented thoroughly. do yourselves a favor , shoot your t.v. !",576755,1346,0,1
13470210_2,The Jews say they are The Chosen Ones The Blacks say they are the original Hebrews Israelites Our worst enemies want to be us and we refuse to accept that we are HIS ! ... and so it goes ..,572059,1346,0,1
31757189_1,There are many alternatives to adopting little mud babies.There is srrogate mothers and invitro fertilization are just two.If these are not financialy possile then wait till it is .,601571,1363,0,1
14411178_1,Actually Monkeys and Apes are more noble creatures and rarely act violent it really is unfare to the Monkeys and Apes to be compared with subhuman Negroids who are by contrast very murderous .,575787,1375,0,1
30542077_3,Get over watching monkeys throw a ball around and get a real hobby for God 's sake .,573472,1348,0,1
30614050_4,I going to get homeschooled tired of looney lefty teachers and the negroes,572282,1362,0,1
14676826_1,"Here is your logic : some whites are corrupt whores for Jewish supremacists , therefore Whites should not oppose Jewish supremacist extermination of all Whites and JS efforts to control humanity 's future .",572070,1371,0,1
30392059_1,"Thank you so much for this , one day I hope the next generation is spared from the travesty brought by Public Schools , and private ( Jews can easily fake being Christian ) .",572770,1362,0,1
13506182_1,Because the communist party was almost all jew out to kill any gentile that stood in their way or had property that the jew - communist wanted .,586372,1395,1,1
14669767_1,"oddly i would find it worst if she here black , since Negroes are the most inferior and scum bag humanoid race in our planet .",575660,1371,0,1
14032559_1,ye i heard that one to. or ' we all came from Africa any way so why dose it matter ' ........ my answer ? ' we evolved to be better',595825,1387,4,1
30546860_1,When they sent n iggers to space the space ships started blowing up .,734911,1348,0,1
30762980_2,I 'm beginning to wonder with all your posts defending the greatest race-traitor and puppet-of-Jewry that Great Britain has ever produced .,572043,1354,0,1
30457462_2,HIV/AIDS is n't killing them off fast enough .,575397,1388,0,1
13503418_1,"Yes, before age of 10 i never saw an negro in real life , when i moved to Holland i was horrified by the amount of non-whites .",576356,1395,0,1
14030596_1,Got to laugh at how he is saying about how forward thinking and how much egyptians love democracy when they are about to hand power to a bunch of hard line Islamic fundamentalists who are more backward and worse than the last mob you Could n't make it up,584498,1387,0,1
13867383_1,"I can honestly say that I have minority friends , and would n't hesitate to deal with the harsh reality that they must be deported .",573582,1391,0,1
14675832_3,"If you look at an Alaskan malamute and a timber wolf that are two different species , they look a lot more alike than say a Congolese and a Swede .",576526,1371,0,1
13589608_2,Beautiful Sweden poisoned by Arab/Muslim trash .,586693,1393,0,1
31760414_1,"Looking at your guys situation makes me realise how lucky I am that my high school is 100 % white however even in my remote countryside community there are more and more black 's moving into the area , and their kids .",633578,1363,0,1
13948582_2,50 shades of brown,579104,1388,0,1
13842819_1,"They re more like a virus than human ; they get inside a country and they taint it with their sickness and pretty soon the whole country goes to hell while the government tries to ban video games because knife crime , rapes and mindless violence has skyrocketed .",591048,1391,4,1
30560620_1,Love how the ape loses so starts going on about how he 's going to shoot him .,578431,1359,0,1
13616113_1,that prince who married that asian is a freak. imagine his half and half kids growing up and trying to marry into other royal families,573589,1393,0,1
13479258_2,Innocent whites including white children all murdered by heartless groid savages .,573455,1345,0,1
14033097_2,This land was founded by whites for whites and I prefer to punish the symptom of urban decay rather than just its zowg figurehead .,575458,1387,0,1
13385970_1,"http://news.bbc.co.uk/2/hi/africa/6217719.stm There you have it folks , Nigeria is acting like one big ghetto queen squeezing out more baby negroes for a bigger handout from the government .",572128,1345,0,1
13284493_1,She was probably the victim of a groid rage rape also .,572180,1345,0,1
14663016_2,Mexicans have plenty of open space in their countries to develop they do n't need ours .,572542,1371,2,1
13563834_1,The point is not the throne itself but the reason for it and what it represents to the apes fighting and tramping for it .,580949,1347,0,1
30405447_2,Once the negros start coming in bunches it will be a hellhole and the whites will have to leave again and start a new community .,572107,1396,0,1
14018061_1,"There's no way to stop them from coming to Canada all that is needed is proof of ownership of a house in India , africa etc and they can enter in on a tourist visa .",579386,1388,0,1
14095559_2,"I do n't know if the person that said that ever leaves the house , but all I ever see are black guys and Mexicans everywhere .",598744,1381,1,1
13474668_1,"But unfortunately , Maine 's become the dumping ground for Somalis and other African trash .",572224,1346,0,1
31330843_3,I 'd like to see Iran wipe Israel off the map .,582650,1346,0,1
30560311_1,Honestly if they ever fired them I 'd expect they 'd do more damage to themselves since the average negro lacks the intellect for basic firearms training .,578431,1359,0,1
13859066_1,You got that right in one go.Lets hope he gets well soon and on his way home If you do n't have these apes in your great Country then count your blessings,572190,1391,0,1
13862051_1,"I registered to make comment but there appear to have a critical error , o dear .",592775,1391,0,1
12959694_1,"Yes, he has a red Firebird so the wigger 's parents thought he had promise just like all those fictional characters on t.v.",578336,1345,5,1
14409149_2,White town saved by the magic negroes of Afreakkaland .,580348,1375,0,1
13621261_7,May they be put away for good .,579371,1393,0,1
14106203_1,Someone Please Tell me what can be done or which people to tell that the Mexicans and or other hispanics here are undercutting price quotes on Good working People .,599920,1381,1,1
14664558_1,Something must be done to halt this terrible wave of immigrants entering Britain .,574356,1371,0,1
30837533_2,"God 's own divine intervention , aided by Jewish money swindled from the goyim .",572087,1346,0,1
14673273_1,"Traditionally, there have always been a lot of them despite the fact that NE Asians are the extreme version of our breeding strategy .",572225,1371,0,1
12874777_2,The non white homelands have so much trash and crime in them that non whites mainly choose to stay away .,577459,1347,0,1
13299159_2,I hope I see the day when thease worthless pieces of crap are OUT OF HERE .,579220,1345,2,1
32833386_1,I can only pray this babboon mongoloid did n't have any children so his seed will not continue on on this Earth .,577714,1345,0,1
14412910_1,All of this diversity crap needs to stop soon whites will be extinct and I 'm not living in a brown world I want a clean white world,584738,1375,0,1
13856374_2,"YouTube - Brussels on 9/11 : For a free Europe , against Islamization",580976,1391,0,1
30565018_2,What makes it suck are the Jews that run it and the Blacks that play in it .,572842,1348,0,1
30424025_2,The have no concept of honour or of having respect for the feelings of others .,579858,1362,11,1
33045538_3,Apparently the Jews ca n't take it when the truth is spoken about them .,580141,1347,0,1
13165044_2,What typical brainwashed liberal lemming .,576954,1345,0,1
30653614_1,"Homosexuals ca n't undo the fight against White Genocide , only hypocrites can , I 'd rather have openly homosexual men on our side than closet fags or sexual deviants who skulk about pretending to be something they 're not .",579130,1346,0,1
30481076_1,He is just telling the truth as usual the filthy jews need to clamp down as soon as possible .,577981,1388,0,1
30582478_1,How much you want to bet it is n't a black male running this operation You can count on white people to be very innovative,575665,1359,4,1
14651426_4,"Elevating the negro to iconic status , is bad business .",574041,1371,0,1
14024252_1,Seeing the teams of white nations have black players in their ranks is a depressing site to see.They should be representing the best of our nations not the worst,577061,1387,0,1
14033722_3,We do not want `` assimilation '' .,572196,1387,0,1
14051885_2,They are supporting the destruction of their future generations .,577719,1383,5,1
14411259_1,Charlton Heston is rolling over in his grave knowing an ape has been elected to the white house .,587961,1375,0,1
13473247_2,"We all know that when their are too many ethnics , the neighbourhood soon turn 's into a slum .",583605,1346,0,1
30451625_5,Niggas do n't wait in no lines .,577167,1388,0,1
30777933_5,How can the Jews be the same as God 's people when they are tring to kill them ?,573685,1363,0,1
13481903_3,"Do you notice how the primate 's , I mean black kid 's arm is around the white girl ?",576661,1346,0,1
14030456_1,We'll never give up ... The jews can keep trying opening our borders and sending their third world minions after the European people but WE WILL NEVER CAPITULATE ...,582828,1387,0,1
13293414_1,"Nevermind, found the new page Knew it had to be a groid .... any report of rape ?",572180,1345,1,1
14673760_2,"Their identity is the Liberal Tribe , and they seek out and morally support other members of their tribe .",573146,1371,0,1
30535761_1,You have to defend yourself with riots happening across the country and invaders flooding across our borders .,580712,1359,0,1
13586829_1,How on earth can they be Swedes when they are the result of race treason ?,581116,1393,0,1
13853553_2,Ireland does n't need arab scum like these .,592575,1391,0,1
14073987_1,One day when true people come to power in italy they will have to go back where they came from ! Italy to Italians !!,574907,1383,0,1
30559248_1,No need to allow FACTS to get in the way of a good White guilt message ! ... and the jew laughs loudly !,572134,1354,0,1
14677826_4,Dumb ass that was just more Jew propaganda that shows their ( and ) your idiocy now go away with your bulls@ $ t,572816,1371,0,1
13843158_2,No white person should ever be compared to a black and other useless races .,590810,1391,0,1
30500254_12,I went outside and the niglet 's mom told me my daughter had hit her first .,575946,1362,0,1
30570257_1,Look what happens when Whites leave black Countries alone to do what they do naturally The blacks in White Countries today should be on their knees thanking Whites for trying to civilize them,574483,1354,0,1
14100224_3,Maybe spread some HATE and intolerance ?,585681,1381,0,1
14059957_1,"Notice how not one of these Hungarians gave one good source validating their preposterous claims , they just came here to complain and start name calling , just as stupid liberals do .",576427,1383,0,1
12883092_2,"http://youtube.com/watch ? v = gdYJjU-Nx6E The maker of this video may be Jewish , not sure , he has a big kosher-lookin nose .",577821,1345,0,1
30641037_3,Many of them are doing just as their masters desire .,572480,1359,0,1
14039975_1,"Was walking through tooting broadway in SW London a couple of weeks ago .... was the only white dude around and all I could see was nigs and pakis walking down the street spitting , made me feel ill !",576641,1387,0,1
14653434_1,i am a white nationalist of a christian faith but still am a white nationalist for racial survival the anti racist christians are the true chirstians ememy,572037,1371,0,1
12872101_1,And most people will laugh and shake their head at you when you tell them that Jews are a very dangerous group of people .,576121,1397,2,1
13501379_2,There are really few Jews and millions of those bastards on the body of our country .,586486,1395,0,1
